{
  "id": "identifier_id",
  "name": "identifier name",
  "description": "a short description of identifier",
  "tags": [
    "tag-1",
    "tag-2"
  ],
  "type": [
    "fair",
    "quality",
    "other"
  ],
  "subtype": [
    "fair",
    "accessible",
    "interoperable",
    "reusable"
  ],
  "release-date": "09-10-2024",
  "version":"0.0.1",
  "doi": "10.5281/zenodo.0000000",
  "authors": {
    "name": "maintainer name",
    "type": [
      "individual"
    ],
    "orcid": "https://orcid.org/0000-0000-0000-0000",
    "email": "someone@somewhere.com"
  }
}
